{
  "client": {"language": "javascript", "library": "ioredis", "version": "5.3.2"},
  "server": {"host": "redis", "port": 6379, "type": "redis", "version": "7.2.4"},
  "timestamp": "2026-03-02T10:02:00Z",
  "duration_ms": 2800,
  "results": [
    {"name": "PING_PONG", "category": "connection", "status": "pass", "duration_ms": 4},
    {"name": "AUTH_password", "category": "connection", "status": "pass", "duration_ms": 3},
    {"name": "SELECT_database", "category": "connection", "status": "pass", "duration_ms": 5},
    {"name": "SET_GET_basic", "category": "strings", "status": "pass", "duration_ms": 2},
    {"name": "SET_NX_flag", "category": "strings", "status": "pass", "duration_ms": 3},
    {"name": "MSET_MGET", "category": "strings", "status": "pass", "duration_ms": 3},
    {"name": "INCR_DECR", "category": "strings", "status": "pass", "duration_ms": 2},
    {"name": "HSET_HGET", "category": "hashes", "status": "pass", "duration_ms": 3},
    {"name": "HGETALL", "category": "hashes", "status": "pass", "duration_ms": 3},
    {"name": "HDEL_HEXISTS", "category": "hashes", "status": "pass", "duration_ms": 2},
    {"name": "LPUSH_RPUSH", "category": "lists", "status": "pass", "duration_ms": 3},
    {"name": "LRANGE", "category": "lists", "status": "pass", "duration_ms": 2},
    {"name": "SADD_SMEMBERS", "category": "sets", "status": "pass", "duration_ms": 3},
    {"name": "SUNION_SINTER", "category": "sets", "status": "pass", "duration_ms": 4},
    {"name": "ZADD_basic", "category": "sorted_sets", "status": "pass", "duration_ms": 3},
    {"name": "ZRANGE_BYSCORE", "category": "sorted_sets", "status": "pass", "duration_ms": 4},
    {"name": "DEL_EXISTS", "category": "key_management", "status": "pass", "duration_ms": 2},
    {"name": "EXPIRE_TTL", "category": "key_management", "status": "pass", "duration_ms": 10},
    {"name": "MULTI_EXEC", "category": "transactions", "status": "pass", "duration_ms": 7},
    {"name": "WATCH_optimistic", "category": "transactions", "status": "pass", "duration_ms": 12},
    {"name": "SUBSCRIBE_PUBLISH", "category": "pubsub", "status": "pass", "duration_ms": 45},
    {"name": "pipeline_SET", "category": "pipelining", "status": "pass", "duration_ms": 18},
    {"name": "EVAL_simple", "category": "lua_scripting", "status": "pass", "duration_ms": 9},
    {"name": "XADD_XRANGE", "category": "streams", "status": "pass", "duration_ms": 7},
    {"name": "SETBIT_GETBIT", "category": "advanced_types", "status": "pass", "duration_ms": 3},
    {"name": "PFADD_PFCOUNT", "category": "advanced_types", "status": "pass", "duration_ms": 4},
    {"name": "wrong_type_error", "category": "edge_cases", "status": "pass", "duration_ms": 3},
    {"name": "binary_data", "category": "edge_cases", "status": "pass", "duration_ms": 4},
    {"name": "CONFIG_GET_SET", "category": "server_commands", "status": "pass", "duration_ms": 4},
    {"name": "FLUSHDB", "category": "server_commands", "status": "pass", "duration_ms": 2}
  ],
  "summary": {
    "total": 30,
    "passed": 30,
    "failed": 0,
    "skipped": 0,
    "errored": 0,
    "pass_rate": 100.0
  }
}
